<?xml version="1.0"?>
<!DOCTYPE configuration SYSTEM "cmx.dtd">
<configuration>
 <resultfile name=""/>
 <measurefile name=""/>

 <resources>
  <component name="Component1" type="threaded" scheduler="RoundRobin">
   <attribute type="timeslice" value="20ns"/>
  </component>
 </resources>

 <mappings>
  <mapping source="top.disp" target="Component1">
    <attribute type="delay" value="100"/>
  </mapping>

   <mapping source="top.coll" target="Component1">
    <attribute type="delay" value="100"/>
  </mapping>

  <mapping source="top.a1.approx" target="Component1">
    <attribute type="delay" value="100"/>
    <attribute type="m_approx::approx" value="100"/>
  </mapping>

  <mapping source="top.a1.dup" target="Component1">
    <attribute type="delay" value="100"/>
    <attribute type="m_dup::dup" value="100"/>
  </mapping>

  <mapping source="top.a1.sqrloop" target="Component1">
    <attribute type="delay" value="100"/>
    <attribute type="m_sqrloop::copy1" value="100"/>
    <attribute type="m_sqrloop::copy2" value="100"/>
    <attribute type="m_sqrloop::store" value="100"/>
  </mapping>

  <mapping source="top.a2.approx" target="Component1">
    <attribute type="delay" value="100"/>
    <attribute type="m_approx::approx" value="100"/>
  </mapping>

  <mapping source="top.a2.dup" target="Component1">
    <attribute type="delay" value="100"/>
    <attribute type="m_dup::dup" value="100"/>
  </mapping>

  <mapping source="top.a2.sqrloop" target="Component1">
    <attribute type="delay" value="100"/>
    <attribute type="m_sqrloop::copy1" value="100"/>
    <attribute type="m_sqrloop::copy2" value="100"/>
    <attribute type="m_sqrloop::store" value="100"/>
  </mapping>

  <mapping source="top.sink" target="Component1">
    <attribute type="delay" value="100"/>
    <attribute type="m_sink::sink" value="100"/>
  </mapping>

  <mapping source="top.src" target="Component1">
    <attribute type="delay" value="100"/>
    <attribute type="m_src::src" value="100"/>
  </mapping>

 </mappings>
</configuration>
